text;relevance_sentence;type;stance;argument;abstract_number;;;;;;;;;;;;;;;;;;;;;;
We argue that considering this hypothesis through the lens of probabilistic inference has the potential to resolve both issues, at least with respect to certain prominent findings in the domain of color cognition.;0;3;2;1;27;;;;;;;;;;;;;;;;;;;;;;
We explore a probabilistic model that is grounded in a presumed universal perceptual color space and in language-specific categories over that space.;0;2;-1;-1;27;;;;;;;;;;;;;;;;;;;;;;
The model predicts that categories will most clearly affect color memory when perceptual information is uncertain.;-1;3;2;1;27;;;;;;;;;;;;;;;;;;;;;;
In line with earlier studies, we show that this model accounts for language-consistent biases in color reconstruction from memory in English speakers, modulated by uncertainty.;0;3;2;1;27;;;;;;;;;;;;;;;;;;;;;;
We also show, to our knowledge for the first time, that such a model accounts for influential existing data on cross-language differences in color discrimination from memory, both within and across categories.;0;3;-1;-1;27;;;;;;;;;;;;;;;;;;;;;;
We suggest that these ideas may help to clarify the debate over the Sapir-Whorf hypothesis.;1;3;1;-1;27;;;;;;;;;;;;;;;;;;;;;;
The Whorfian hypothesis has received support from recent findings in psychology, linguistics, and anthropology.;1;1;2;1;18;;;;;;;;;;;;;;;;;;;;;;
This evidence has been interpreted as supporting the view that language modulates all stages of perception and cognition, in accordance with Whorf’s original proposal.;1;1;2;1;18;;;;;;;;;;;;;;;;;;;;;;
In light of a much broader body of evidence on time perception, I propose to evaluate these findings with respect to their scope.;-1;2;-1;-1;18;;;;;;;;;;;;;;;;;;;;;;
When assessed collectively, the entire body of evidence on time perception shows that the Whorfian hypothesis has a limited scope and that it does not affect early stages of time perception.;-1;3;1;1;18;;;;;;;;;;;;;;;;;;;;;;
In particular, all the available evidence shows that the scope of language modulation is limited in the case of time perception, and that the most important mechanisms for time perception are cognitive clocks and simultaneity windows, which we use to perceive the temporal properties of events.;1;3;1;1;18;;;;;;;;;;;;;;;;;;;;;;
Language modulation has distorting effects, but only at later stages of processing or with respect to specific categorization tasks.;0;3;1;1;18;;;;;;;;;;;;;;;;;;;;;;
The paper explains what is the role of these effects in the context of all the available evidence on time cognition and perception.;-1;3;-1;-1;18;;;;;;;;;;;;;;;;;;;;;;
We report a cross-cultural study of speakers of Setswana and of English carried out as a test of the linguistic relativity hypothesis (the Sapir-Whorf hypothesis).;1;2;-1;-1;19;;;;;;;;;;;;;;;;;;;;;;
These languages differ in their number of ‘basic’ colour terms-English has eleven and Setswana has five and in the position of some colour category boundaries.;0;1;-1;-1;19;;;;;;;;;;;;;;;;;;;;;;
Speakers of the two languages did a ‘triads’ task in which they chose which of three colours was least like the other two.;-1;2;-1;-1;19;;;;;;;;;;;;;;;;;;;;;;
There were two types of triad: ‘controls’, for which any linguistic influences should lead to the same choices, and ‘experimental’ groups.;-1;2;-1;-1;19;;;;;;;;;;;;;;;;;;;;;;
Thus the universalist position predicts that the choices of the two samples should be essentially the same for all triads, whereas the relativist position predicts that choice should be the same for the control triads, but differ for the experimental triads.;-1;1;-1;-1;19;;;;;;;;;;;;;;;;;;;;;;
The most striking feature of the results was that the choices made by the two samples were very similar for both kinds of triads, thus supporting universalism.;-1;3;0;1;19;;;;;;;;;;;;;;;;;;;;;;
But, there were also small but reliable differences associated with the linguistic differences, thus supporting Whorfianism.;1;3;2;1;19;;;;;;;;;;;;;;;;;;;;;;
Overall, it appears that there is a strong universal influence on colour choice but this universal influence can be moderated by cultural influences such as language, a position consistent with ‘weak Whorfianism ’.;1;3;2;1;19;;;;;;;;;;;;;;;;;;;;;;
The present research adopts a functional approach to examining the effects of language use on personality perception and dialectical thinking.;1;2;-1;-1;20;;;;;;;;;;;;;;;;;;;;;;
We propose that language use activates corresponding cultural mindsets, which in turn influence social perception, thinking, and behavior.;1;3;2;1;20;;;;;;;;;;;;;;;;;;;;;;
Whether language shapes cognition has long been a controversial issue.;1;1;1;-1;20;;;;;;;;;;;;;;;;;;;;;;
Four studies recruited Chinese-English bilinguals (N = 129 in Study 1, 229 in Study 2, 68 in Study 3, 106 in Study 4) and used within-subjects and between-subjects design, written and behavioral reports, and self- and other perceptions.;-1;2;-1;-1;20;;;;;;;;;;;;;;;;;;;;;;
The four studies converged to show that Chinese-English bilinguals exhibit higher dialectical thinking and more variations in self- and observer ratings of personality when using the Chinese language than when using English.;0;3;2;1;20;;;;;;;;;;;;;;;;;;;;;;
Furthermore, dialectical thinking predicted more self- and other-perceived variations in personality and behavior across bilingual contexts.;0;1;2;1;20;;;;;;;;;;;;;;;;;;;;;;
These results highlight the important role of culture in understanding the relations between language and cognition, and attest to the malleability of personality perception and dialectical thinking within and across individuals in response to culture-related linguistic cues.;1;3;2;1;20;;;;;;;;;;;;;;;;;;;;;;
Economists have sometimes adopted a ‘Whorfian’ view that differences in languages can cause differences in how their speakers think and behave.;1;1;2;1;21;;;;;;;;;;;;;;;;;;;;;;
Psychological experiments have shown both support for this hypothesis and evidence against it.;-1;1;1;1;21;;;;;;;;;;;;;;;;;;;;;;
Specific arguments that language causes thought, which have been made in recent economics papers, are examined in the light of what linguistics tells us about superficial and underlying variation.;0;2;-1;-1;21;;;;;;;;;;;;;;;;;;;;;;
In the translation part of this study, 22 Japanese short stories were translated into English by native speakers of English and 20 English short stories were translated into Japanese by Japanese.;-1;2;-1;-1;22;;;;;;;;;;;;;;;;;;;;;;
The passive passages in the Japanese version were classified into either adversative or non-adversative passive.;-1;2;-1;-1;22;;;;;;;;;;;;;;;;;;;;;;
They were then compared with the corresponding passages in English to determine equivalence of translation.;-1;2;-1;-1;22;;;;;;;;;;;;;;;;;;;;;;
Distortion in translation was found to be in the direction of the translator's way of perceiving things in terms of his first language.;0;3;2;1;22;;;;;;;;;;;;;;;;;;;;;;
The perception study compared the perception of Japanese with that of Americans by using stick figure cartoons depicting interpersonal conflict situations with negative outcomes.;-1;2;-1;-1;22;;;;;;;;;;;;;;;;;;;;;;
As hypothesized, Japanese were found to have a greater tendency than Americans to attribute responsibility to others.;-1;3;2;1;22;;;;;;;;;;;;;;;;;;;;;;
In order to separate the role of language from other crucial cultural factors in the perception of interpersonal events, 20 monolingual (English-speaking) Americans of Japanese ancestory and 90 Germans in Berlin were also tested.;0;2;-1;-1;22;;;;;;;;;;;;;;;;;;;;;;
"No significant differences were found between the Americans and Germans; but the English-speaking Japanese-Americans fell in between the Americans and the Japanese, closer to the Japanese.";-1;3;2;1;22;;;;;;;;;;;;;;;;;;;;;;
"The use of the ""traditional passive"" form of the Japanese verb indicates to a native speaker that the subject of the verb was involuntarily subjected to something unpleasant.";-1;1;-1;-1;23;;;;;;;;;;;;;;;;;;;;;;
"When combined with the causative form (passive causative), it is felt that the subject of the sentence was ""caused to"" take an action and is therefore not responsible for the act nor its outcome.";-1;1;-1;-1;23;;;;;;;;;;;;;;;;;;;;;;
These meanings must be expressed in English by adding whole clauses or phrases.;-1;1;-1;-1;23;;;;;;;;;;;;;;;;;;;;;;
It was hypothesized that the availability of these constructions in Japanese would cause native speakers to interpret interpersonal events by using these passive verb forms while speakers of English would not.;-1;3;2;1;23;;;;;;;;;;;;;;;;;;;;;;
In a translation study, the original and the translated versions of 20 Japanese and 21 English short stories were compared.;-1;2;-1;-1;23;;;;;;;;;;;;;;;;;;;;;;
It was found that the English-speaking translators tended to disregard the connotative meaning of the traditional passive while Japanese translators tended to read such meanings into the English original.;1;3;2;1;23;;;;;;;;;;;;;;;;;;;;;;
A perception study was based on cartoons of interpersonal conflict situations to test whether Japanese subjects would tend to attribute responsibility for the negative outcome to others rather than themselves.;-1;2;-1;-1;23;;;;;;;;;;;;;;;;;;;;;;
In this test the overall difference between Japanese and Americans was significant at the .001 level in the predicted direction.;-1;3;2;1;23;;;;;;;;;;;;;;;;;;;;;;
In related tests, however, Americans who had studied Japanese used the traditional passive about as much as did native speakers.;-1;3;0;1;23;;;;;;;;;;;;;;;;;;;;;;
The Whorf hypothesis holds that we view the world filtered through the semantic categories of our native language.;1;1;-1;-1;24;;;;;;;;;;;;;;;;;;;;;;
Over the years, consensus has oscillated between embrace and dismissal of this hypothesis.;-1;1;1;1;24;;;;;;;;;;;;;;;;;;;;;;
Here, we review recent findings on the naming and perception of color, and argue that in this semantic domain the Whorf hypothesis is half right, in two different ways: (1) language influences color perception primarily in half the visual field, and (2) color naming across languages is shaped by both universal and language-specific forces.;1;1;1;1;24;;;;;;;;;;;;;;;;;;;;;;
To the extent that these findings generalize to other semantic domains they suggest a possible resolution of the debate over the Whorf hypothesis.;1;1;1;-1;24;;;;;;;;;;;;;;;;;;;;;;
Using sources, which address various theories of Linguistic Relativity - Rossi-Landi (1973), Penn (1972), Miller (1968), and Rollins (1980) – the unique aspects of these theories are explained.;1;2;-1;-1;25;;;;;;;;;;;;;;;;;;;;;;
The intent of the paper is to expose Benjamin Lee Whorf not as the soul progenitor of the theory (that language culture and thought are interrelated), but as a reviser of centuries of scholarship.;1;2;-1;-1;25;;;;;;;;;;;;;;;;;;;;;;
The theories of Hamann, Herder, Humboldt, Boas, and Sapir are examined and conclusions are made on their influences on and differences from the Whorfian Hypothesis.;1;2;-1;-1;25;;;;;;;;;;;;;;;;;;;;;;
The Whorfian Hypothesis, which states that the structure of one's language influences the understanding of reality, is examined in relation to the Chinese language and culture and to the English language and American culture.;1;2;-1;-1;26;;;;;;;;;;;;;;;;;;;;;;
Examples supporting the Whorfian Hypothesis are offered in language relating to personal relationships.;1;2;2;1;26;;;;;;;;;;;;;;;;;;;;;;
Research on the Hypothesis is reviewed briefly, and various interpretations are noted.;1;2;-1;-1;26;;;;;;;;;;;;;;;;;;;;;;
It is concluded that while the Hypothesis in its stronger forms has been discredited, Whorf's work has opened linguistic theory to greater consideration of the relationship between language and thought.;1;3;0;1;26;;;;;;;;;;;;;;;;;;;;;;
The Sapir–Whorf hypothesis, the theory that language influences thought to the extent that people who speak different languages perceive the world differently, is discussed in the context of current calls to maintain and promote global linguistic diversity.;1;2;-1;-1;28;;;;;;;;;;;;;;;;;;;;;;
Cross-cultural psychological research is examined to assess the extent to which the hypothesis can be shown to be true.;-1;2;-1;-1;28;;;;;;;;;;;;;;;;;;;;;;
In the 1970s, research on colour perception appeared to provide evidence against the hypothesis.;0;1;0;1;28;;;;;;;;;;;;;;;;;;;;;;
More recent studies have shown that there are in fact significant and reliable differences across languages in how colour is perceived, classified, and remembered.;1;1;2;1;28;;;;;;;;;;;;;;;;;;;;;;
Research at higher levels of language is also assessed.;-1;2;-1;-1;28;;;;;;;;;;;;;;;;;;;;;;
Language appears to exert considerable influence over how people categorise, evaluate, and remember the world, especially in languages where nouns belong to different semantic categories.;1;3;2;1;28;;;;;;;;;;;;;;;;;;;;;;
Particular ways of thinking may also be more difficult in some languages than others.;-1;3;2;1;28;;;;;;;;;;;;;;;;;;;;;;
This may only mean that it is more cognitively taxing to arrive at the same notion or it can mean that an idea is highly unlikely to be expressed in a particular language.;-1;3;2;1;28;;;;;;;;;;;;;;;;;;;;;;
These differences may even transcend languages and cultures.;-1;3;2;1;28;;;;;;;;;;;;;;;;;;;;;;
It is concluded that, given the available evidence, it is vital to allow alternative perspectives of the world to be available by maintaining and promoting global linguistic diversity.;1;3;2;1;28;;;;;;;;;;;;;;;;;;;;;;
The idea that language shapes the way we think, often associated with Benjamin Whorf, has long been decried as not only wrong but also fundamentally wrong-headed.;1;1;0;1;29;;;;;;;;;;;;;;;;;;;;;;
Yet, experimental evidence has reopened debate about the extent to which language influences nonlinguistic cognition, particularly in the domain of time.;1;1;1;1;29;;;;;;;;;;;;;;;;;;;;;;
In this article, I will first analyze an influential argument against the Whorfian hypothesis and show that its anti-Whorfian conclusion is in part an artifact of conflating two distinct questions: Do we think in language and Does language shape thought.;1;2;2;1;29;;;;;;;;;;;;;;;;;;;;;;
Next, I will discuss crosslinguistic differences in spatial metaphors for time and describe experiments that demonstrate corresponding differences in nonlinguistic mental representations.;1;2;2;1;29;;;;;;;;;;;;;;;;;;;;;;
Finally, I will sketch a simple learning mechanism by which some linguistic relativity effects appear to arise.;1;2;2;1;29;;;;;;;;;;;;;;;;;;;;;;
Although people may not think in language, speakers of different languages develop distinctive conceptual repertoires as a consequence of ordinary and presumably universal neural and cognitive processes.;1;3;2;1;29;;;;;;;;;;;;;;;;;;;;;;
Investigations of the Sapir-Whorf hypothesis often ask whether there is a difference in the non-linguistic behavior of speakers of two languages, generally without modeling the underlying process.;1;1;-1;-1;30;;;;;;;;;;;;;;;;;;;;;;
Such an approach leaves underexplored the relative contributions of language and universal aspects of cognition, and how those contributions differ across languages.;1;1;2;1;30;;;;;;;;;;;;;;;;;;;;;;
We explore the naming and non-linguistic pile-sorting of spatial scenes across speakers of five languages via a computational model grounded in an influential proposal: that language will affect cognition when non-linguistic information is uncertain.;1;2;-1;-1;30;;;;;;;;;;;;;;;;;;;;;;
We report two findings.;-1;3;-1;-1;30;;;;;;;;;;;;;;;;;;;;;;
First, native language plays a small but significant role in predicting spatial similarity judgments across languages, consistent with earlier findings.;1;3;2;1;30;;;;;;;;;;;;;;;;;;;;;;
Second, thesize of the native-language role varies systematically, such that finer-grained semantic systems appear to shape similarity judgments more than coarser-grained systems do.;0;3;2;1;30;;;;;;;;;;;;;;;;;;;;;;
These findings capture the tradeoff between language-specific and universal forces in cognition, and how that tradeoff varies across languages.;1;3;2;1;30;;;;;;;;;;;;;;;;;;;;;;
Debates about linguistic relativity commonly focus on one question: Does language affect thought.;1;1;-1;-1;32;;;;;;;;;;;;;;;;;;;;;;
This yes-or-no question does not do justice to the complexity of Whorf's ideas and skirts several issues of great importance to Whorf.;1;1;-1;-1;32;;;;;;;;;;;;;;;;;;;;;;
My first aim in this article is to recover the arguments that got lost in translation of Whorf's ideas into the Sapir-Whorf hypothesis.;1;1;-1;-1;32;;;;;;;;;;;;;;;;;;;;;;
I will show that, for Whorf, languages were also one of the ways in which we think, scientists were not immune to language effects, and the key to advancement of Western science was multilingual awareness.;1;3;2;1;32;;;;;;;;;;;;;;;;;;;;;;
My second aim is to draw on these insights to articulate a Whorfian agenda for the field of second language acquisition (SLA) that asks new questions about second language learning and cognition and expands the boundaries of the field and the scope, duration, and locations of SLA research.;1;3;1;-1;32;;;;;;;;;;;;;;;;;;;;;;
The traditional approach to the Sapir-Whorf hypothesis looks at language and categorically different perception or interpretation of the environment.;1;1;-1;-1;33;;;;;;;;;;;;;;;;;;;;;;
Another aspect of linguistic relativity relates language to the process of cognition itself, including the ease or facility of cognitive processes.;1;1;-1;-1;33;;;;;;;;;;;;;;;;;;;;;;
With particular reference to the Chinese language and its unique orthography, some evidence for language-related differences in the manner of information processing is reviewed.;0;2;-1;-1;33;;;;;;;;;;;;;;;;;;;;;;
These include visual form perception, manipulation of numbers, and memory versus manipulation and elaboration of verbal information.;-1;3;1;1;33;;;;;;;;;;;;;;;;;;;;;;
These differences have implications for cognitive development as well as crosscultural testing and comparison.;-1;3;1;1;33;;;;;;;;;;;;;;;;;;;;;;
The Sapir-Whorf Hypothesis, long considered a factor in intercultural communication, is discussed.;1;1;-1;-1;34;;;;;;;;;;;;;;;;;;;;;;
Empirical studies that have tended to validate the hypothesis are reviewed, and the hypothesis is then considered from the standpoint of empirical and scientific research requirements.;-1;2;-1;-1;34;;;;;;;;;;;;;;;;;;;;;;
It is shown that the hypothesis has never been formally defined for testing, and therefore does not exist as a scientifically testable thesis.;-1;3;0;1;34;;;;;;;;;;;;;;;;;;;;;;
As a result, all studies that have attempted to interpret empirical data accorded to the hypothesis are either flawed or invalid because they have tested something other than the hypothesis.;-1;3;0;1;34;;;;;;;;;;;;;;;;;;;;;;
It is concluded that the Sapir-Whorf Hypothesis exists only as a notion, and has no meaningful relation to intercultural communication.;1;3;0;1;34;;;;;;;;;;;;;;;;;;;;;;
Modern approaches to the Whorfian linguistic relativity question have reframed it from one of whether language shapes our thinking or not, to one that tries to understand the factors that contribute to the extent and nature of any observable influence of language on perception.;1;1;-1;-1;35;;;;;;;;;;;;;;;;;;;;;;
The current paper demonstrates that such understanding is significantly enhanced by moving the evidentiary basis toward a more biologically grounded empirical arena.;-1;3;2;1;35;;;;;;;;;;;;;;;;;;;;;;
We review recent neuroscientific evidence using a variety of methodological techniques that reveal the functional organisation and temporal distribution of the ubiquitous relationship between language and cognitive processing in the human brain.;-1;3;2;1;35;;;;;;;;;;;;;;;;;;;;;;
The domain of colors has often attracted attention of researchers looking for evidence for the Sapir-Whorf hypothesis, and influence of language on color perception has been confirmed in many studies.;1;1;2;1;36;;;;;;;;;;;;;;;;;;;;;;
The present paper aims, on the one hand, at providing further evidence for the effect on a healthy sample, and, on the other, at extending research to an aphasic sample affected by color anomia, a disorder that has never been dealt in the literature about the topic.;-1;2;2;1;36;;;;;;;;;;;;;;;;;;;;;;
A test based on color similarity judgments was administered to both samples.;-1;2;-1;-1;36;;;;;;;;;;;;;;;;;;;;;;
Speakers were either native speakers of Italian or of German.;-1;2;-1;-1;36;;;;;;;;;;;;;;;;;;;;;;
The colors of the test belonged to the green and blue area of color space, and judgments on the green/blue boundary and on the light blue/dark blue boundary were analyzed.;-1;2;-1;-1;36;;;;;;;;;;;;;;;;;;;;;;
The former boundary exists in both languages, while the latter is only marked in Italian.;-1;2;-1;-1;36;;;;;;;;;;;;;;;;;;;;;;
Results provided supporting evidence for a Whorfian effect in the domain of colors.;1;3;2;1;36;;;;;;;;;;;;;;;;;;;;;;
However, this does not contradict the theory about the existence of universal basic color terms.;0;3;1;-1;36;;;;;;;;;;;;;;;;;;;;;;
Furthermore, the need for a more qualitative – rather than quantitative – approach to data is stressed.;-1;3;-1;-1;36;;;;;;;;;;;;;;;;;;;;;;
The Sapir-Whorf's hypothesis provokes intellectual discussion about the strong impact language has on our perception of the world around us.;1;1;2;1;37;;;;;;;;;;;;;;;;;;;;;;
Language plays a role as a communication tool in shaping the human thought, it's a basic thing part of human thought and perception.;1;1;2;1;37;;;;;;;;;;;;;;;;;;;;;;
This article explores the powerful influence of language on our understanding of the world.;1;2;2;1;37;;;;;;;;;;;;;;;;;;;;;;
We will investigate complex relationships between language and human thought, examining how language shapes our thoughts, emotions, and perception.;1;2;2;-1;37;;;;;;;;;;;;;;;;;;;;;;
Additionally, we will explore linguistic concepts relativity, also known as the Sapir-Whorf hypothesis, which states that the structure our language influences our understanding of reality.;1;2;-1;-1;37;;;;;;;;;;;;;;;;;;;;;;
By recognizing the intricate relationship between language and cognition, we gain valuable insight into the human experience and the complex ways in which language shapes our individual and collective lives.;1;3;2;-1;37;;;;;;;;;;;;;;;;;;;;;;
Language, culture, and mind are closely related, each of these extracts reflects one another.;0;1;2;-1;38;;;;;;;;;;;;;;;;;;;;;;
The relationship between language, culture and mind of speakers is a basic idea of Sapir and Whorf's theories and hypotheses.;1;1;-1;-1;38;;;;;;;;;;;;;;;;;;;;;;
Language politeness that is rooted in the splash of the cultural values of the speaking community, including can be seen from the packaging of the information structure as outlined in the sentence of a language.;-1;1;-1;-1;38;;;;;;;;;;;;;;;;;;;;;;
The construction of different clauses grammatically packs different information structures and politeness values.;-1;1;-1;-1;38;;;;;;;;;;;;;;;;;;;;;;
The way of thinking between cultures as outlined in a writing will be different in the way it is delivered.;0;3;2;1;38;;;;;;;;;;;;;;;;;;;;;;
The purpose of this study is to describe culture in expressive writing, is seen from the hypothesis of Edwar Sapir and Benjamin Lee Whorf.;1;2;2;1;38;;;;;;;;;;;;;;;;;;;;;;
A research approach is suggested to investigate the issue of medium of instruction in teaching math.;-1;2;-1;-1;39;;;;;;;;;;;;;;;;;;;;;;
The approach is based on the weak version of Whorfs linguistic determinism which states that variations in lexical, semantic, syntactic and pragmatic aspects of language influence thought.;1;1;-1;-1;39;;;;;;;;;;;;;;;;;;;;;;
The approach is used to study the observation that people have a difficult time expressing in Filipino, material that they have learned in English.;0;2;2;1;39;;;;;;;;;;;;;;;;;;;;;;
This paper looks into the role of language use in the transfer of information in soiving mathematical problems.;-1;2;-1;-1;39;;;;;;;;;;;;;;;;;;;;;;
"Earlier studies have shown that language-based representations of problems affect performance in math word problem; and that problem-specific information plays an important function in transfer.";-1;1;2;1;39;;;;;;;;;;;;;;;;;;;;;;
Based on these studies, it was predicted that transfer of information would be better when the language used to study the prohlcms is the same as that used in the transfer test.;-1;1;2;1;39;;;;;;;;;;;;;;;;;;;;;;
The goal of this study was to test a weak form of the Sapir-Whorf Hypothesis dealing with one of the biggest unsolved questions in linguistics: Does language affect the way we think.;1;2;-1;-1;40;;;;;;;;;;;;;;;;;;;;;;
Grammatical systems in the world’s languages differ in many aspects.;-1;1;-1;-1;40;;;;;;;;;;;;;;;;;;;;;;
Unlike English or German many languages group nouns on the basis of noun classifiers.;-1;1;-1;-1;40;;;;;;;;;;;;;;;;;;;;;;
Recently research has adressed the question if these linguistic categories built up by classifier systems influence non-linguistic thought.;1;1;-1;-1;40;;;;;;;;;;;;;;;;;;;;;;
In this paper we studied Mandarin Chinese and Thai—two languages with classifier systems.;-1;2;-1;-1;40;;;;;;;;;;;;;;;;;;;;;;
Although both are classifier languages they categorize objects in different ways.;-1;1;-1;-1;40;;;;;;;;;;;;;;;;;;;;;;
We tested if these system differences lead to different similarity judgements of objects in a non-linguistic rating task (participants had to rate the similarity of picture pairs).;-1;2;-1;-1;40;;;;;;;;;;;;;;;;;;;;;;
In contrast to previous studies we suprisingly observed no difference in categorization.;-1;3;0;1;40;;;;;;;;;;;;;;;;;;;;;;
