text;relevance_sentence;type;stance;argument;abstract_number;;;;;;;;;;;;;;;;;;;;;;
It seems that the so-called Whorf effect, i. e. that language affects the way we perceive and categorize the world, diminishes rapidly over the time speakers are exposed to a different language system such as, in this case, German.;1;3;0;1;40;;;;;;;;;;;;;;;;;;;;;;
The idea that different languages foster different world views in their speakers is part of a tradition popularized by.;1;1;-1;-1;41;;;;;;;;;;;;;;;;;;;;;;
Wilhelm von Humboldt in the 18th century long before it became associated with Whorf.;1;1;-1;-1;41;;;;;;;;;;;;;;;;;;;;;;
In this long process, another two American linguists, Boas and Sapir, are also well-known for their great contributions to this notion.;0;1;-1;-1;41;;;;;;;;;;;;;;;;;;;;;;
This paper tries to trace the linguistic relativity back to its origin and contextualize its diachronic developments from Europe to America.;1;2;-1;-1;41;;;;;;;;;;;;;;;;;;;;;;
It is true, however, that it was Benjamin Lee Whorf, the chemical engineer and fire-insurance by profession and the linguist by avocation, who had undertaken extensive research into the language Hopi during 1932-1935 and Maya in late 1930s, and it was he who went further in indicating the relationship between language and thought.;1;1;1;-1;41;;;;;;;;;;;;;;;;;;;;;;
As a core part of Whorf’s theory complex, the linguistic relativity was once interpreted in two ways: linguistic determinism which means that language determines the way people think and linguistic relativism which implies that language influences the way people think.;1;1;-1;-1;41;;;;;;;;;;;;;;;;;;;;;;
An emotional version of Sapir-Whorf hypothesis suggests that differences in language emotionalities influence differences among cultures no less than conceptual differences.;1;1;-1;-1;42;;;;;;;;;;;;;;;;;;;;;;
"Conceptual contents of languages and cultures to significant extent are determined by words and their semantic differences; these could be borrowed among languages and exchanged among cultures.";0;1;-1;-1;42;;;;;;;;;;;;;;;;;;;;;;
Emotional differences, as suggested in the paper, are related to grammar and mostly cannot be borrowed.;0;3;1;1;42;;;;;;;;;;;;;;;;;;;;;;
Conceptual and emotional mechanisms of languages are considered here along with their functions in the mind and cultural evolution.;0;3;1;1;42;;;;;;;;;;;;;;;;;;;;;;
"A fundamental contradiction in human mind is considered: language evolution requires reduced emotionality, but ""too low"" emotionality makes language ""irrelevant to life,"" disconnected from sensory-motor experience.";-1;3;1;1;42;;;;;;;;;;;;;;;;;;;;;;
Neural mechanisms of these processes are suggested as well as their mathematical models: the knowledge instinct, the language instinct, the dual model connecting language and cognition, dynamic logic, neural modeling fields.;-1;3;-1;-1;42;;;;;;;;;;;;;;;;;;;;;;
Mathematical results are related to cognitive science, linguistics, and psychology.;-1;3;-1;-1;42;;;;;;;;;;;;;;;;;;;;;;
Experimental evidence and theoretical arguments are discussed.;-1;3;1;-1;42;;;;;;;;;;;;;;;;;;;;;;
Approximate equations for evolution of human minds and cultures are obtained.;-1;3;-1;-1;42;;;;;;;;;;;;;;;;;;;;;;
"Their solutions identify three types of cultures: ""conceptual""-pragmatic cultures, in which emotionality of language is reduced and differentiation overtakes synthesis resulting in fast evolution at the price of uncertainty of values, self doubts, and internal crises; ""traditional-emotional"" cultures where differentiation lags behind synthesis, resulting in cultural stability at the price of stagnation; and ""multi-cultural"" societies combining fast cultural evolution and stability.";-1;3;1;1;42;;;;;;;;;;;;;;;;;;;;;;
Unsolved problems and future theoretical and experimental directions are discussed.;-1;3;-1;-1;42;;;;;;;;;;;;;;;;;;;;;;
The Argentine writer Jorge Luis Borges says that “every writer creates his precursors.;-1;1;-1;-1;43;;;;;;;;;;;;;;;;;;;;;;
His work changes our conception of the past, as it will change the future.”;-1;1;-1;-1;43;;;;;;;;;;;;;;;;;;;;;;
In his writings, Benjamin Lee Whorf cites a wide and eclectic set of inspirations—which is to say that he creates, retrospectively, a set of intellectual lineages leading up to him.;1;1;-1;-1;43;;;;;;;;;;;;;;;;;;;;;;
Although some of these are scientifically respectable—quantum mechanics, relativity, colloidal chemistry, non-Euclidean geometry—others, such as psychoanalysis and “unbiased cultural anthropology,” are less evident for a chemical engineer, and some, such as his fondness for Theosophy and for the work of the occultist Fabre d’Olivet, have been used to discredit him.;-1;1;1;1;43;;;;;;;;;;;;;;;;;;;;;;
If we suspend judgment, can we fairly characterize the full field of Whorf’s retrojected precursors and can this field as a whole help understand his modification of his future and our present, in Whorf’s current reappearance in some unexpected places in literature (e.g., in speculative fiction and fantasy)?;1;3;2;1;43;;;;;;;;;;;;;;;;;;;;;;
"Benjamin L. Whorf's provocative thesis that human thinking depends on the ""grammar"" people speak is still highly controversial.";1;1;1;1;44;;;;;;;;;;;;;;;;;;;;;;
In this paper I make a suggestion for a more rational solution of the problem.;-1;2;-1;-1;44;;;;;;;;;;;;;;;;;;;;;;
Whorf's crucial example, the conceptualization of space and time in the Hopi language, has been re-analyzed on the grounds of new material collected during field-work on the Hopi reservation.;0;3;-1;-1;44;;;;;;;;;;;;;;;;;;;;;;
The results of Dr. Malotki's research into Hopi space are also mentioned.;-1;3;-1;-1;44;;;;;;;;;;;;;;;;;;;;;;
We would both like to correct some of Whorf's statements.;1;3;1;-1;44;;;;;;;;;;;;;;;;;;;;;;
Finally this paper presents the Hopi view of the world and outlines a general solution for the basic problem: the interrelationship between thinking, language, and culture.;0;3;2;1;44;;;;;;;;;;;;;;;;;;;;;;
The Sapir–Whorf hypothesis delineates two principles.;1;1;-1;-1;45;;;;;;;;;;;;;;;;;;;;;;
One is the principle of linguistic determinism, which says that the way one thinks is determined by the language one speaks.;1;1;-1;-1;45;;;;;;;;;;;;;;;;;;;;;;
Taken at its extreme, this principle means that, if we do not have a word for it, then we cannot think about it.;0;1;-1;-1;45;;;;;;;;;;;;;;;;;;;;;;
The second is the principle of linguistic relativity, sometimes called linguistic diversity, which says that the languages of the world are all very different.;1;1;-1;-1;45;;;;;;;;;;;;;;;;;;;;;;
These principles raise some important issues for cross-cultural communication.;-1;1;-1;-1;45;;;;;;;;;;;;;;;;;;;;;;
If how one thinks is a reflection of the language one speaks, then the speakers of two very different languages must think very differently.;1;3;0;-1;45;;;;;;;;;;;;;;;;;;;;;;
This could render effective and successful intercultural communication extremely difficult, if not impossible.;-1;3;0;1;45;;;;;;;;;;;;;;;;;;;;;;
Contemporary linguists qualify the Sapir–Whorf hypothesis.;1;3;1;-1;45;;;;;;;;;;;;;;;;;;;;;;
The paper raises the question of whether the linguistic relativity proposal, also known as the Sapir-Whorf Hypothesis, should be used as a frame of reference for modern research into the relationship of language to cognition.;1;1;-1;-1;46;;;;;;;;;;;;;;;;;;;;;;
The question is discussed in the context of Whorf’s (1956) writings, with emphasis on factors that are crucial to the proposal, i.e. language, thought, and behavior.;1;2;-1;-1;46;;;;;;;;;;;;;;;;;;;;;;
The second issue addressed by the paper is whether linguistic categories provide an accurate window on cognition, as was suggested by Whorf and in some of the more recent debates.;1;2;-1;-1;46;;;;;;;;;;;;;;;;;;;;;;
The analysis takes the form of a correlational study which examines the categorization criteria applied in tests that require language-based and language-neutral judgments.;-1;2;-1;-1;46;;;;;;;;;;;;;;;;;;;;;;
For many years, a common assumption in linguistics has been that the anthology of Whorf's papers (1956) espouses a distinct 'hypothesis' - the language system determines the manner in which its speakers understand reality.;1;1;-1;-1;47;;;;;;;;;;;;;;;;;;;;;;
This goes under the names of 'linguistic determinism' or the 'Whorfian hypothesis'.;1;1;-1;-1;47;;;;;;;;;;;;;;;;;;;;;;
As confirmation of this espousal, many stylisticians and critical linguists cite a famous paragraph in the paper 'Science and Linguistics' (SL).;-1;1;2;1;47;;;;;;;;;;;;;;;;;;;;;;
The `hypothesis', however, is actually a misconstrual of Whorf's writings.;1;3;0;1;47;;;;;;;;;;;;;;;;;;;;;;
An exploration of his papers, as Ellis (1993) points out, shows that there is no mention of a 'hypothesis' or any overall suggestion of such a strong deterministic relationship between linguistic systems and thought.;1;1;0;1;47;;;;;;;;;;;;;;;;;;;;;;
I offer an explanation as to why many stylisticians and critical linguists confirm the misleading 'hypothesis' as Whorf's position, and because I am particularly interested in misreading of Whorf by such linguists my main focus is SL rather than any of his other papers.;1;2;0;1;47;;;;;;;;;;;;;;;;;;;;;;
The reasons I provide are connected with the pervasiveness of objectivist background assumptions of the nature of language and thought and with how in stylistics and critical linguistics it has been overlooked that SL is intended for an educated lay-audience.;-1;3;0;1;47;;;;;;;;;;;;;;;;;;;;;;
I then examine the famous paragraph without the distraction of the 'hypothesis'.;0;3;0;1;47;;;;;;;;;;;;;;;;;;;;;;
I show that, for Whorf, when we talk we affirm common conceptualizations extant in the culture rather than conceptualization being determined by the language system itself.;1;3;0;1;47;;;;;;;;;;;;;;;;;;;;;;
Finally, I indicate some implications of this reading of Whorf for stylistics and critical linguistics.;1;3;-1;-1;47;;;;;;;;;;;;;;;;;;;;;;
The Whorfian hypothesis suggests that differences between languages cause differences in cognitive processes.;1;1;-1;-1;48;;;;;;;;;;;;;;;;;;;;;;
Support for this idea comes from studies that find that patterns of colour memory errors made by speakers of different languages align with differences in colour lexicons.;0;1;2;1;48;;;;;;;;;;;;;;;;;;;;;;
The current study provides a large-scale investigation of the relationship between colour language and colour memory, adopting a cross-linguistic and developmental approach.;-1;2;-1;-1;48;;;;;;;;;;;;;;;;;;;;;;
Colour memory on a delayed matching-to-sample (XAB) task was investigated in 2 language groups with differing colour lexicons, for 3 developmental stages and 2 regions of colour space.;-1;2;-1;-1;48;;;;;;;;;;;;;;;;;;;;;;
Analyses used a Bayesian technique to provide simultaneous assessment of two competing hypotheses (H1–Whorfian effect present, H0–Whorfian effect absent).;1;2;-1;-1;48;;;;;;;;;;;;;;;;;;;;;;
Results of the analyses consistently favoured H0.;-1;3;0;1;48;;;;;;;;;;;;;;;;;;;;;;
The findings suggest that Whorfian effects on colour memory are not reliable and that the importance of such effects should not be overestimated.;1;3;0;1;48;;;;;;;;;;;;;;;;;;;;;;
This article critically examines the Sapir-Whorf Hypothesis, which explores the relationship between language and thought.;1;2;-1;-1;49;;;;;;;;;;;;;;;;;;;;;;
The discussion begins with a theoretical framework outlining the distinction between linguistic determinism and linguistic relativity, followed by the contributions of Edward Sapir and Benjamin Lee Whorf.;1;3;-1;-1;49;;;;;;;;;;;;;;;;;;;;;;
It analyzes the ways in which language can shape cognitive processes, drawing on examples from cross-linguistic studies of color, space, and time.;0;3;2;-1;49;;;;;;;;;;;;;;;;;;;;;;
The paper also highlights major criticisms of the hypothesis, particularly its strong deterministic version, while acknowledging the relevance of weaker forms of linguistic relativity.;1;3;1;1;49;;;;;;;;;;;;;;;;;;;;;;
Modern perspectives, including Neo-Whorfian research, cognitive linguistics, and interdisciplinary approaches, are explored to show how the hypothesis has evolved in contemporary scholarship.;1;3;-1;-1;49;;;;;;;;;;;;;;;;;;;;;;
The article concludes by emphasizing the hypothesis’s implications for translation studies, second language acquisition, and multicultural communication, suggesting that while strong determinism is untenable, linguistic relativity remains an important concept for understanding the interplay between language and cognition.;1;3;2;1;49;;;;;;;;;;;;;;;;;;;;;;
In this article, we test a variant of the Sapir-Whorf Hypothesis in the area of complex network theory.;1;2;-1;-1;50;;;;;;;;;;;;;;;;;;;;;;
This is done by analyzing social ontologies as a new resource for automatic language classification.;-1;2;-1;-1;50;;;;;;;;;;;;;;;;;;;;;;
Our method is to solely explore structural features of social ontologies in order to predict family resemblances of languages used by the corresponding communities to build these ontologies.;-1;2;-1;-1;50;;;;;;;;;;;;;;;;;;;;;;
This approach is based on a reformulation of the Sapir-Whorf Hypothesis in terms of distributed cognition.;1;2;-1;-1;50;;;;;;;;;;;;;;;;;;;;;;
Starting from a corpus of 160 Wikipedia-based social ontologies, we test our variant of the Sapir-Whorf Hypothesis by several experiments, and find out that we outperform the corresponding baselines.;1;3;2;1;50;;;;;;;;;;;;;;;;;;;;;;
All in all, the article develops an approach to classify linguistic networks of tens of thousands of vertices by exploring a small range of mathematically well-established topological indices.;-1;3;-1;-1;50;;;;;;;;;;;;;;;;;;;;;;
The importance of peace to human civilisation has raised peace to a somewhat universally essential condition.;-1;1;-1;-1;51;;;;;;;;;;;;;;;;;;;;;;
Since peace means different things to different people, there is a void in the debate on the conceptualisation of peace.;0;1;-1;-1;51;;;;;;;;;;;;;;;;;;;;;;
Galtung (1969, 1990) views peace as being either negative or positive and Richmond (2007) adopts a liberal standpoint, arguing that the concept of peace itself is ontologically unstable and essentially contested.;-1;1;-1;-1;51;;;;;;;;;;;;;;;;;;;;;;
The issue of conceptualisation has been met with much hesitation on the part of the research community.;-1;1;-1;-1;51;;;;;;;;;;;;;;;;;;;;;;
Explanations giving reasons for the increasing use of adjectives to qualify peace are lacking in previous research.;-1;1;-1;-1;51;;;;;;;;;;;;;;;;;;;;;;
This article contributes to filling this gap in the peace research literature by attempting to use linguistic theory to provide reasons why there are many variations in the usage of the peace concept constructed mostly through the help and use of adjectives.;-1;2;-1;-1;51;;;;;;;;;;;;;;;;;;;;;;
It is argued that the idea behind the Sapir-Whorf hypothesis can assist our understanding of the reasons for this growing use of adjectives in the context of present day globalisation of the peace concept.;1;3;2;1;51;;;;;;;;;;;;;;;;;;;;;;
The Whorf hypothesis holds that differences between languages induce differences in perception and/or cognition in their speakers.;1;1;-1;-1;52;;;;;;;;;;;;;;;;;;;;;;
Much of the experimental work pursuing this idea has focused on the domain of color and has centered on the issue of whether linguistically coded color categories influence color discrimination.;0;1;-1;-1;52;;;;;;;;;;;;;;;;;;;;;;
A new perspective has been cast on the debate by recent results that suggest that language influences color discrimination strongly in the right visual field but not in the left visual field (LVF).;0;1;2;1;52;;;;;;;;;;;;;;;;;;;;;;
This asymmetry is likely related to the contralateral projection of visual fields to cerebral hemispheres and the specialization of the left hemisphere for language.;-1;1;2;1;52;;;;;;;;;;;;;;;;;;;;;;
The current study presents three independent experiments that replicate and extend these earlier results by using different tasks and testing across different color category boundaries.;-1;2;2;1;52;;;;;;;;;;;;;;;;;;;;;;
Our results differ in one respect: although we find that Whorfian effects on color are stronger for stimuli in the right visual field than in the LVF, we find that there are significant category effects in the LVF as well.;1;3;2;1;52;;;;;;;;;;;;;;;;;;;;;;
The origin of the significant category effect in the LVF is considered, and two factors that might account for the pattern of results are proposed.;-1;3;-1;-1;52;;;;;;;;;;;;;;;;;;;;;;
Language teaching theorists, unanimously, recognize de facto that culture teaching is a vital component of any language course, be it second or foreign.;-1;1;2;1;53;;;;;;;;;;;;;;;;;;;;;;
Knowledge of the target culture, awareness of its dominant characteristics and of the striking differences between the target culture and the mainstream culture should constantly be part of a language teaching menu.;-1;1;2;1;53;;;;;;;;;;;;;;;;;;;;;;
"Thus, considering a priori the oft-held view that language teaching consists of the four skills plus culture is at present all too often held to be partially true, yet more deluding than enlightening; culture in the language teaching-learning process ought not to be is an expendable fifth skill: an added frill.";0;1;-1;-1;53;;;;;;;;;;;;;;;;;;;;;;
Additionally, culture teaching should not be restricting, as it were, to a mere passing of information about the people of the target language, and about their general thoughts and worldviews.;-1;1;-1;-1;53;;;;;;;;;;;;;;;;;;;;;;
However, a large load of what is called culture is a sheer social construct, an unmitigated product of self- perceptions and others’ weltanschauung.;0;1;2;1;53;;;;;;;;;;;;;;;;;;;;;;
This ethno-linguistic dimension, assuming that different languages are likely to lead people to perform different actions because language shapes their worldview, is the nub of our research work.;1;2;2;1;53;;;;;;;;;;;;;;;;;;;;;;
Language-wise, what is the place of this hypothesis, and its pedagogical implications in our Algerian EFL classroom.;1;2;-1;-1;53;;;;;;;;;;;;;;;;;;;;;;
The answer to the question represents the general lay-out of the present article.;-1;2;-1;-1;53;;;;;;;;;;;;;;;;;;;;;;
The relation between language and thought has occupied linguists for at least a century.;1;1;-1;-1;54;;;;;;;;;;;;;;;;;;;;;;
Neo-Whorfianism, a weak version of the controversial Sapir-Whorf hypothesis, holds that our thoughts are subtly influenced by the grammatical structures of our native language.;1;1;-1;-1;54;;;;;;;;;;;;;;;;;;;;;;
One area of investigation in this vein focuses on how the grammatical gender of nouns affects the way we perceive the corresponding objects.;0;1;-1;-1;54;;;;;;;;;;;;;;;;;;;;;;
For instance, does the fact that key is masculine in German (der Schl?ssel), but feminine in Spanish (la llave) change the speakers' views of those objects?;0;1;-1;-1;54;;;;;;;;;;;;;;;;;;;;;;
Psycholinguistic evidence presented by Boroditsky et al. (2003, §4) suggested the answer might be yes: When asked to produce adjectives that best described a key, German and Spanish speakers named more stereotypically masculine and feminine ones, respectively.;0;1;2;1;54;;;;;;;;;;;;;;;;;;;;;;
However, recent attempts to replicate those experiments have failed (Mickan et al., 2014).;-1;1;0;1;54;;;;;;;;;;;;;;;;;;;;;;
In this work, we offer a computational analogue of Boroditsky et al. (2003, §4)'s experimental design on 9 languages, finding evidence against neo-Whorfianism.;1;3;0;1;54;;;;;;;;;;;;;;;;;;;;;;
The Whorf Hypothesis, or linguistic relativity, is a controversial theory positing that structural features of different languages can exert perceptible influences on aspects of cognition and conceptual worldview.;1;1;1;-1;55;;;;;;;;;;;;;;;;;;;;;;
Decades of empirical research has challenged the theory’s more extreme speculations, but subsequent empirical and theoretical developments have yielded substantial support for its weaker form.;-1;1;1;1;55;;;;;;;;;;;;;;;;;;;;;;
Within this framework, cross-linguistic investigations have increasingly focused on suggestive differences between Chinese and Indo-European languages, whose typological and conceptual divergences provide fertile ground for examining the interface between language and thought.;0;1;-1;-1;55;;;;;;;;;;;;;;;;;;;;;;
Research in this area has addressed domains such as grammatical structure, metaphor systems, counterfactual reasoning, abstract representation, and the processing of nominal and verbal categories.;-1;1;-1;-1;55;;;;;;;;;;;;;;;;;;;;;;
This chapter provides a general introduction to the topics covered in this collection of papers.;-1;2;-1;-1;55;;;;;;;;;;;;;;;;;;;;;;
"‘Whorfian Economics’ proposes that elements of a language can influence a speaker’s economic behavior; it is developed from the Sapir-Whorf hypothesis that the forms of a specific language can affect how its speakers think.";1;1;-1;-1;56;;;;;;;;;;;;;;;;;;;;;;
We examine proposals relating to four elements of language which vary cross-linguistically: the classification of all nouns into distinct genders, the possibility of omitting first- and second-person pronouns, the use of irrealis (which may express uncertainty), and whether future events must be expressed in a distinct future form (future time reference).;0;1;-1;-1;56;;;;;;;;;;;;;;;;;;;;;;
We suggest that in most cases, the complexity of the linguistic phenomena casts doubt on the Whorfian economic claims, but we also suggest that the most plausible of the causal effects hold for the future time reference distinction.;1;3;1;1;56;;;;;;;;;;;;;;;;;;;;;;
This was Chen’s (2013) original Whorfian economic argument, a proposal that languages which do not require explicit marking of future events have speakers who feel ‘closer’ to the future, positively influencing their savings behavior.;1;1;2;1;56;;;;;;;;;;;;;;;;;;;;;;
We also consider the use of bilingual speakers in Whorfian economics, where an individual’s choice between two languages may influence their thinking (or economic behavior) at that moment.;1;2;-1;-1;56;;;;;;;;;;;;;;;;;;;;;;
The significant role language occupies in human lives has led to the question whether language is merely a tool for expressing human thoughts or does it actually shape human thoughts.;1;1;-1;-1;57;;;;;;;;;;;;;;;;;;;;;;
Over the years many scholars have attempted to find answers for this question.;-1;1;-1;-1;57;;;;;;;;;;;;;;;;;;;;;;
One such influential study led to Sapir-Whorf hypothesis.;1;1;-1;-1;57;;;;;;;;;;;;;;;;;;;;;;
This paper seeks to answer the question why the Sapir-Whorf Hypothesis, also known as linguistic relativity proposal, still popular in academia even after numerous criticisms against it.;1;2;0;1;57;;;;;;;;;;;;;;;;;;;;;;
The paper incorporates the methodology of a textual analysis of study books and scholarly work based on the topic.;-1;2;-1;-1;57;;;;;;;;;;;;;;;;;;;;;;
Further the paper discusses Whorf’s writings and a selection of studies that support and refute the Sapir-Whorf hypothesis.;1;2;1;1;57;;;;;;;;;;;;;;;;;;;;;;
This study is an attempt to shed light on this heavily discussed area of human language and to add in to the existing knowledge on the subject.;-1;2;-1;-1;57;;;;;;;;;;;;;;;;;;;;;;
Do speakers of different languages think alike because of the universality of the experience of being human or do we all think differently because of differences in our languages?;1;1;-1;-1;58;;;;;;;;;;;;;;;;;;;;;;
The answer to these questions has changed throughout the history of linguistic thought, ranging from observing languages merely as tools for expressing our thoughts to strongly believing that languages shape and even constrain our thoughts.;-1;1;-1;-1;58;;;;;;;;;;;;;;;;;;;;;;
This paper presents an overview of two most important theories that deal with these questions: the “rise and fall” of linguistic determinism (Whorfianism), and the development of its more cautious version – linguistic relativism (Neo-Whorfianism) – advocated today primarily within the framework of cognitive views of language, as well as their criticisms, most commonly within the framework of generative views of language.;1;1;1;1;58;;;;;;;;;;;;;;;;;;;;;;
The purpose of the research is to investigate the Sapir-Whorf hypothesis of linguistic relativity by investigating the use of emojis in formal communication situations.;1;2;-1;-1;59;;;;;;;;;;;;;;;;;;;;;;
Emojis, while commonly associated with informal or casual conversation, are increasingly being used in official circumstances (Rehman & Butt, 2024).;-1;1;-1;-1;59;;;;;;;;;;;;;;;;;;;;;;
This study examines their inclusion into formal communication to see whether their existence affects language perception and cognition, as proposed by the Sapir-Whorf hypothesis.;1;2;-1;-1;59;;;;;;;;;;;;;;;;;;;;;;
The suitable method of this study was qualitative in which an online survey with semi-structured closed-ended and open-ended questions was done with 10 volunteers who had been working in formal settings for at least 5 years.;-1;2;-1;-1;59;;;;;;;;;;;;;;;;;;;;;;
These individuals had an excellent notion regarding linguistic relativity.;1;3;2;1;59;;;;;;;;;;;;;;;;;;;;;;
The data were analysed qualitatively by theme analysis.;-1;3;-1;-1;59;;;;;;;;;;;;;;;;;;;;;;
This study used linguistic analysis and experimental approaches to investigate the possible influence of emojis on language structure, semantics, and communication dynamics in formal settings (Abbasi et al., 2024).;-1;2;-1;-1;59;;;;;;;;;;;;;;;;;;;;;;
The findings add to our knowledge of how language features like emojis impact perception and expression in various communicative situations, influencing both linguistic theory and practical applications in formal communication settings.;0;3;2;1;59;;;;;;;;;;;;;;;;;;;;;;
